{
  "schemaVersion": "v2-external-brain-execution-observation/v6",
  "scenarioId": "px5_scenario_34",
  "capturedAt": "2026-09-08T10:39:50.416Z",
  "evidenceClass": "production_acceptance",
  "entryContext": {
    "status": "not_applicable"
  },
  "attempts": [
    {
      "sequence": 1,
      "entryAction": {
        "eventType": "status_recovery",
        "actor": "test_fault_fixture",
        "trustedUserGesture": false,
        "requestId": "px5_px5_scenario_34",
        "origin": "status_recovery",
        "routeIntent": "source_library",
        "workspaceId": "ws_default",
        "operationId": "op_00000000000000000000002844",
        "observedAt": "2026-09-08T10:39:50.416Z"
      },
      "backgroundResult": {
        "outcome": "not_applicable",
        "requestId": "px5_px5_scenario_34",
        "observedAt": "2026-09-08T10:39:50.416Z"
      }
    }
  ],
  "routeEvents": [
    {
      "kind": "push",
      "resolvedPath": "#/knowledge/sources?workspaceId=ws_default",
      "routeIntent": "source_library",
      "workspaceId": "ws_default",
      "observedAt": "2026-09-08T10:39:50.416Z"
    }
  ],
  "containerObservations": [
    {
      "container": "side_panel",
      "ids": {
        "status": "not_applicable"
      },
      "observedAt": "2026-09-08T10:39:50.416Z"
    },
    {
      "container": "background",
      "ids": {
        "status": "not_applicable"
      },
      "observedAt": "2026-09-08T10:39:50.416Z"
    },
    {
      "container": "workspace_page",
      "ids": {
        "status": "observed",
        "workspaceId": "ws_default"
      },
      "observedAt": "2026-09-08T10:39:50.416Z"
    }
  ],
  "runtimeObservation": {
    "transportOutcome": "response",
    "observedAt": "2026-09-08T10:39:50.416Z",
    "ids": {
      "status": "observed",
      "workspaceId": "ws_default",
      "sourceId": "src_00000000000000000000002843",
      "operationId": "op_00000000000000000000002844"
    },
    "responseFingerprint": "98fc4a2101868e92bb8b39a2c4ec5c265bc1c47fd2d866d1b8fb88ba00e64f6e",
    "transportEvidence": {
      "path": "docs/active/project/evidence/v2_external_brain_productization/px-5/px-5-raw-e2e.json",
      "sha256": "98fc4a2101868e92bb8b39a2c4ec5c265bc1c47fd2d866d1b8fb88ba00e64f6e"
    }
  },
  "ingestCounters": {
    "before": 0,
    "after": 0
  }
}
