{
  "schemaVersion": "v2-external-brain-execution-observation/v6",
  "scenarioId": "px5_scenario_05",
  "capturedAt": "2026-09-08T10:39:50.416Z",
  "evidenceClass": "production_acceptance",
  "entryContext": {
    "status": "not_applicable"
  },
  "attempts": [
    {
      "sequence": 1,
      "entryAction": {
        "eventType": "view_source",
        "actor": "user",
        "trustedUserGesture": true,
        "requestId": "9d8e24b6-c4ad-47b1-b62f-04db03c667a9",
        "origin": "view_source",
        "routeIntent": "source_detail",
        "workspaceId": "ws_default",
        "sourceId": "src_00000000000000000000009888",
        "operationId": "op_00000000000000000000009889",
        "observedAt": "2026-09-08T10:39:40.257Z"
      },
      "backgroundResult": {
        "outcome": "focused_existing",
        "requestId": "9d8e24b6-c4ad-47b1-b62f-04db03c667a9",
        "observedAt": "2026-09-08T10:39:40.261Z",
        "tabId": 450540019,
        "workspaceUrl": "chrome-extension://lmaehaoccfhkoojpplmngdnbiflopphg/workspace.html#/knowledge/sources/src_00000000000000000000009888?workspaceId=ws_default"
      }
    }
  ],
  "routeEvents": [
    {
      "kind": "push",
      "resolvedPath": "#/knowledge/sources/src_00000000000000000000009888?workspaceId=ws_default",
      "routeIntent": "source_detail",
      "workspaceId": "ws_default",
      "sourceId": "src_00000000000000000000009888",
      "observedAt": "2026-09-08T10:39:50.416Z"
    }
  ],
  "containerObservations": [
    {
      "container": "side_panel",
      "ids": {
        "status": "observed",
        "workspaceId": "ws_default",
        "sourceId": "src_00000000000000000000009888",
        "operationId": "op_00000000000000000000009889"
      },
      "observedAt": "2026-09-08T10:39:50.416Z"
    },
    {
      "container": "background",
      "ids": {
        "status": "observed",
        "workspaceId": "ws_default",
        "sourceId": "src_00000000000000000000009888",
        "operationId": "op_00000000000000000000009889"
      },
      "observedAt": "2026-09-08T10:39:50.416Z"
    },
    {
      "container": "workspace_page",
      "ids": {
        "status": "observed",
        "workspaceId": "ws_default",
        "sourceId": "src_00000000000000000000009888",
        "operationId": "op_00000000000000000000009889"
      },
      "observedAt": "2026-09-08T10:39:50.416Z"
    }
  ],
  "runtimeObservation": {
    "transportOutcome": "response",
    "observedAt": "2026-09-08T10:39:50.416Z",
    "ids": {
      "status": "observed",
      "workspaceId": "ws_default",
      "sourceId": "src_00000000000000000000009888",
      "operationId": "op_00000000000000000000009889"
    },
    "responseFingerprint": "98fc4a2101868e92bb8b39a2c4ec5c265bc1c47fd2d866d1b8fb88ba00e64f6e",
    "transportEvidence": {
      "path": "docs/active/project/evidence/v2_external_brain_productization/px-5/px-5-raw-e2e.json",
      "sha256": "98fc4a2101868e92bb8b39a2c4ec5c265bc1c47fd2d866d1b8fb88ba00e64f6e"
    }
  },
  "ingestCounters": {
    "before": 0,
    "after": 0
  }
}
